{
  "schema_version": "1",
  "seq": 42,
  "prev_hash": "0000000000000000000000000000000000000000000000000000000000000000",
  "hash": "abcdef0123456789abcdef0123456789abcdef0123456789abcdef0123456789",
  "ts": "2026-05-17T10:30:01.123Z",
  "run_id": "run-2026-05-17-001",
  "kind": "finding_emitted",
  "actor": { "type": "orchestrator", "id": "runner@host01" },
  "scenario_id": "scn-token-replay",
  "finding_id": "AQA-2026-0001",
  "payload": { "severity": "critical" }
}
